{
  "schemaVersion": "1.0.0",
  "inventory": "app-shell",
  "source": "docs/plans/prioritized-roadmap-implementation-plan.md#app-shell-evaluation-contract",
  "status": "frozen",
  "candidates": [
    "root",
    "header",
    "sidebar",
    "main",
    "secondary panel",
    "mobile navigation",
    "skip link",
    "resizable-region adapter"
  ]
}
